{
  "contract_id": "production-signal",
  "schema_version": "4.0.0",
  "signal_id": "fixture-flat-2026-07-29",
  "sequence": 1,
  "state": "FLAT",
  "as_of": "2026-07-29",
  "latest_complete_date": "2026-07-29",
  "generated_at": "2026-07-29T08:10:00Z",
  "champion": null,
  "previous_head_sha256": null,
  "previous_signal_sha256": null,
  "target_positions": [],
  "reason_codes": ["NO_CHAMPION"],
  "contract_set": {
    "dataset_manifest_sha256": "aaaaaaaaaaaaaaaaaaaaaaaaaaaaaaaaaaaaaaaaaaaaaaaaaaaaaaaaaaaaaaaa",
    "dataset_snapshot_sha256": "bbbbbbbbbbbbbbbbbbbbbbbbbbbbbbbbbbbbbbbbbbbbbbbbbbbbbbbbbbbbbbbb",
    "universe_snapshot_sha256": "8888888888888888888888888888888888888888888888888888888888888888",
    "champion_sha256": null,
    "cost_model_sha256": "cccccccccccccccccccccccccccccccccccccccccccccccccccccccccccccccc",
    "market_rules_sha256": "dddddddddddddddddddddddddddddddddddddddddddddddddddddddddddddddd",
    "execution_policy_sha256": "eeeeeeeeeeeeeeeeeeeeeeeeeeeeeeeeeeeeeeeeeeeeeeeeeeeeeeeeeeeeeeee",
    "portfolio_risk_sha256": "ffffffffffffffffffffffffffffffffffffffffffffffffffffffffffffffff",
    "code_sha256": "1111111111111111111111111111111111111111111111111111111111111111",
    "config_sha256": "2222222222222222222222222222222222222222222222222222222222222222",
    "lockfile_sha256": "3333333333333333333333333333333333333333333333333333333333333333"
  }
}
